Season,Episode,Name,Rating,Story,Director,Writers,Stars
12,11,The Paintball Scattering,7.3,"Penny and Leonard organize a paintball game, which results in mayhem when Sheldon becomes jealous of Amy. Raj catches Anu with her ex-boyfriend. Stuart doesn't want to move in with Denise.",Mark Cendrowski,"Chuck Lorre, Bill Prady, Steve Holland","Johnny Galecki, Jim Parsons, Kaley Cuoco"
12,12,The Propagation Proposition,7.1,"Penny's ex-boyfriend Zack learns that he is infertile, so he asks Leonard for help; Koothrappali attempts to mend things with his ex-fiancee Anu.",Mark Cendrowski,"Chuck Lorre, Bill Prady, Maria Ferrari","Johnny Galecki, Jim Parsons, Kaley Cuoco"
12,13,The Confirmation Polarization,7.1,"Sheldon and Amy are thrilled when their super asymmetry theory is proven by two physicists, until they try to kick Amy off the Nobel nomination. Bernadette gets one of her drugs approved and wants a reluctant Penny to head the sales team.",Mark Cendrowski,"Chuck Lorre, Bill Prady, Steve Holland","Johnny Galecki, Jim Parsons, Kaley Cuoco"
12,14,The Meteorite Manifestation,7.1,Sheldon is thrilled to help Bernadette and Howard navigate bureaucracy concerning a neighbor's non-compliant balcony until he learns they too have ignored codes. Leonard is disappointed when his friends are uninterested in his new laser.,Mark Cendrowski,"Chuck Lorre, Bill Prady, Eric Kaplan","Johnny Galecki, Jim Parsons, Kaley Cuoco"
12,15,The Donation Oscillation,7.4,"Penny tries to throw a wrench into Leonard's plan to be a sperm donor for her ex-boyfriend; Wolowitz, Bernadette, Anu and Koothrappali turn Koothrappali's canceled bachelor party into a couple's trip aboard the ""vomit comet.""",Mark Cendrowski,"Chuck Lorre, Bill Prady, Steve Holland","Johnny Galecki, Jim Parsons, Kaley Cuoco"
12,16,The D & D Vortex,7.9,"The gang finds out Wil Wheaton hosts a celebrity Dungeons and Dragons game involving William Shatner, Joe Manganiello, Kareem Abdul-Jabbar and Kevin Smith. Deception and betrayal are the path to make it to the one open seat.",Mark Cendrowski,"Chuck Lorre, Bill Prady, Eric Kaplan","Johnny Galecki, Jim Parsons, Kaley Cuoco"
12,17,The Conference Valuation,7.1,"Bernadette and Penny travel to San Diego for a pharmaceutical sales convention. Back home, Amy and the guys experiment on the Wolowitz children when Sheldon finds a book on it.",Mark Cendrowski,"Chuck Lorre, Bill Prady, Steve Holland","Johnny Galecki, Jim Parsons, Kaley Cuoco"
12,18,The Laureate Accumulation,7.1,"Rivals Pemberton and Campbell charm America on a publicity tour so Sheldon and Amy try to win over Nobel laureates Kip Thorne, George Smoot and Frances Arnold. Halley's fear of the dark causes opportunity and conflict at the Wolowitz home.",Mark Cendrowski,"Chuck Lorre, Bill Prady, David Goetsch","Johnny Galecki, Jim Parsons, Kaley Cuoco"
12,19,The Inspiration Deprivation,7.0,Contemplating what it would mean to all women if she were to win a Nobel Prize causes Amy to have a meltdown. Koothrappali and Wolowitz try to relive the good old days after Wolowitz buys a scooter that looks like the one he had years ago.,Mark Cendrowski,"Chuck Lorre, Bill Prady, Steve Holland","Johnny Galecki, Jim Parsons, Kaley Cuoco"
12,20,The Decision Reverberation,7.1,Koothrappali is worried people won't take him seriously in his own field after publishing a paper that suggests he may have discovered alien life. Leonard wants to be the principal investigator on a plasma physics study.,Mark Cendrowski,"Chuck Lorre, Bill Prady, Eric Kaplan","Johnny Galecki, Jim Parsons, Kaley Cuoco"
12,21,The Plagiarism Schism,7.3,"Kripke has proof that Dr. Pemberton plagiarized his thesis in college, and Sheldon and Amy aren't sure if they should turn him in. Wolowitz learns that Bernadette wasn't the only waitress at the Cheesecake Factory who had a crush on him.",Nikki Lorre,"Chuck Lorre, Bill Prady, Steve Holland","Johnny Galecki, Jim Parsons, Kaley Cuoco"
12,22,The Maternal Conclusion,7.9,"Leonard is pleasantly surprised when Beverly comes to visit and she's genuinely kind to him, until he finds out the real reason she's there. Also, Denise and Stuart overstay their welcome at the Wolowitz house.",Kristy Cecil,"Chuck Lorre, Bill Prady, Maria Ferrari","Johnny Galecki, Jim Parsons, Kaley Cuoco"
12,23,The Change Constant,9.0,Sheldon and Amy await big news.,Mark Cendrowski,"Chuck Lorre, Bill Prady, Steve Holland","Johnny Galecki, Jim Parsons, Kaley Cuoco"
12,24,The Stockholm Syndrome,9.5,"Bernadette and Wolowitz leave their kids for the first time; Penny and Leonard try to keep a secret; Sheldon and Amy stick together; and Koothrappali makes a new friend, as the gang travels together into an uncharted future.",Mark Cendrowski,"Chuck Lorre, Bill Prady, Steve Holland","Johnny Galecki, Jim Parsons, Kaley Cuoco"
